Sheet: Sheet1
A2: My Data
A4: Items A | B4: Items B | C4: Items C | D4: Items D | E4: Items E | F4: Items F | G4: Items G | H4: Items H
A5: 12 | B5: 23 | C5: 33 | D5: 66 | E5: 11 | F5: 87 | G5: 99 | H5: 33
A6: 23 | B6: 22 | C6: 33 | D6: 77 | E6: 31 | F6: 22 | G6: 45 | H6: 56
A7: 34 | B7: 11 | C7: 12 | D7: 23 | E7: 22 | F7: 34 | G7: 11 | H7: 12
A8: 45 | B8: 43 | C8: 54 | D8: 88 | E8: 36 | F8: 45 | G8: 45 | H8: 37
A9: 65 | B9: 65 | C9: 65 | D9: 65 | E9: 13 | F9: 65 | G9: 9 | H9: 35
A10: 34 | B10: 22 | C10: 27 | D10: 22 | E10: 32 | F10: 23 | G10: 23 | H10: 32
A11: =SUM(R[-6]C[0]:R[-1]C[0]) -> 213 | B11: =SUM(R[-6]C[0]:R[-1]C[0]) -> 186 | C11: =SUM(R[-6]C[0]:R[-1]C[0]) -> 224 | D11: =SUM(R[-6]C[0]:R[-1]C[0]) -> 341 | E11: =SUM(R[-6]C[0]:R[-1]C[0]) -> 145 | F11: =SUM(R[-6]C[0]:R[-1]C[0]) -> 276 | G11: =SUM(R[-6]C[0]:R[-1]C[0]) -> 232 | H11: =SUM(R[-6]C[0]:R[-1]C[0]) -> 205

Sheet: Sheet2
A2: Alphabetical List of Products
A3: =DATE(2002,12,18) -> 37608
A5: Product Name | B5: Category Name | C5: Quantity Per Unit | D5: Units In Stock
A6: Aniseed Syrup | B6: Condiments | C6: 12 - 550 ml bottles | D6: 13
A7: Boston Crab Meat | B7: Seafood | C7: 24 - 4 oz tins | D7: 123
A8: Camembert Pierrot | B8: Dairy Products | C8: 15 - 300 g rounds | D8: 19
A9: Carnarvon Tigers | B9: Seafood | C9: 16 kg pkg. | D9: 42
A10: Chai | B10: Beverages | C10: 10 boxes x 20 bags | D10: 39
A11: Chang | B11: Beverages | C11: 24 - 12 oz bottles | D11: 17
A12: Chartreuse verte | B12: Beverages | C12: 750 cc per bottle | D12: 69
A13: Chef Anton's Cajun Seasoning | B13: Condiments | C13: 48 - 6 oz jars | D13: 53
A14: Chocolade | B14: Confections | C14: 10 pkgs. | D14: 15
A15: Escargots de Bourgogne | B15: Seafood | C15: 24 pieces | D15: 62
A16: Filo Mix | B16: Grains/Cereals | C16: 16 - 2 kg boxes | D16: 38
A17: Geitost | B17: Dairy Products | C17: 500 g | D17: 112
A18: Genen Shouyu | B18: Condiments | D18: 39
A19: Gnocchi di nonna Alice | B19: Grains/Cereals | D19: 21
A20: Gorgonzola Telino | B20: Dairy Products | D20: 0
A21: Grandma's Boysenberry Spread | B21: Condiments | C21: 12 - 8 oz jars | D21: 120
A22: Gravad lax | B22: Seafood | C22: 12 - 500 g pkgs. | D22: 11
A23: Gudbrandsdalsost | B23: Dairy Products | C23: 10 kg pkg. | D23: 26
A24: Gula Malacca | B24: Condiments | C24: 20 - 2 kg bags | D24: 27
A25: Ikura | B25: Seafood | C25: 12 - 200 ml jars | D25: 31
A26: Inlagd Sill | B26: Seafood | C26: 24 - 250 g jars | D26: 112
A27: Ipoh Coffee | B27: Beverages | C27: 16 - 500 g tins | D27: 17
A28: Jack's New England Clam Chowder | B28: Seafood | C28: 12 - 12 oz cans | D28: 85
A29: Konbu | B29: Seafood | C29: 2 kg box | D29: 24
A30: Laughing Lumberjack Lager | B30: Beverages | C30: 24 - 12 oz bottles | D30: 52
A31: Longlife Tofu | B31: Produce | C31: 5 kg pkg. | D31: 4
A32: Louisiana Fiery Hot Pepper Sauce | B32: Condiments | C32: 32 - 8 oz bottles | D32: 76
A33: Louisiana Hot Spiced Okra | B33: Condiments | C33: 24 - 8 oz jars | D33: 4
A34: Manjimup Dried Apples | B34: Produce | C34: 50 - 300 g pkgs. | D34: 20
A35: Mascarpone Fabioli | B35: Dairy Products | C35: 24 - 200 g pkgs. | D35: 9
A36: Maxilaku | B36: Confections | C36: 24 - 50 g pkgs. | D36: 10
A37: Mozzarella di Giovanni | B37: Dairy Products | C37: 24 - 200 g pkgs. | D37: 14
A38: Nord-Ost Matjeshering | B38: Seafood | C38: 10 - 200 g glasses | D38: 10
A39: Northwoods Cranberry Sauce | B39: Condiments | C39: 12 - 12 oz jars | D39: 6
A40: NuNuCa Nu?Nougat-Creme | B40: Confections | C40: 20 - 450 g glasses | D40: 76
A41: Outback Lager | B41: Beverages | C41: 24 - 355 ml bottles | D41: 15
A42: Pavlova | B42: Confections | C42: 32 - 500 g boxes | D42: 29
A43: P鈚?chinois | B43: Meat/Poultry | C43: 24 boxes x 2 pies | D43: 115
A44: Queso Cabrales | B44: Dairy Products | C44: 1 kg pkg. | D44: 22
A45: Queso Manchego La Pastora | B45: Dairy Products | C45: 10 - 500 g pkgs. | D45: 86
A46: Raclette Courdavault | B46: Dairy Products | C46: 5 kg pkg. | D46: 79
A47: Ravioli Angelo | B47: Grains/Cereals | C47: 24 - 250 g pkgs. | D47: 36
A48: Sasquatch Ale | B48: Beverages | C48: 24 - 12 oz bottles | D48: 111
A49: Schoggi Schokolade | B49: Confections | C49: 100 - 100 g pieces | D49: 49
A50: Scottish Longbreads | B50: Confections | C50: 10 boxes x 8 pieces | D50: 6
A51: Sir Rodney's Marmalade | B51: Confections | C51: 30 gift boxes | D51: 40
A52: Sir Rodney's Scones | B52: Confections | C52: 24 pkgs. x 4 pieces | D52: 3
A53: Spegesild | B53: Seafood | C53: 4 - 450 g glasses | D53: 95
A54: Steeleye Stout | B54: Beverages | C54: 24 - 12 oz bottles | D54: 20
A55: Tarte au sucre | B55: Confections | C55: 48 pies | D55: 17
A56: Teatime Chocolate Biscuits | B56: Confections | C56: 10 boxes x 12 pieces | D56: 25
A57: Tofu | B57: Produce | C57: 40 - 100 g pkgs. | D57: 35
A58: Uncle Bob's Organic Dried Pears | B58: Produce | C58: 12 - 1 lb pkgs. | D58: 15
A59: Valkoinen suklaa | B59: Confections | C59: 12 - 100 g bars | D59: 65
A60: Vegie-spread | B60: Condiments | C60: 15 - 625 g jars | D60: 24
A61: Zaanse koeken | B61: Confections | C61: 10 - 4 oz boxes | D61: 36
A62: SUM | D62: =SUM(R[-56]C:R[-1]C) -> 2319

Sheet: Evaluation Warning
A5: Evaluation Only. Created with Aspose.Cells for Java.Copyright 2003 - 2016 Aspose Pty Ltd.

Sheet: Evaluation Warning (1)
A5: Evaluation Only. Created with Aspose.Cells for Java.Copyright 2003 - 2016 Aspose Pty Ltd.

Sheet: Evaluation Warning (2)
A5: Evaluation Only. Created with Aspose.Cells for Java.Copyright 2003 - 2016 Aspose Pty Ltd.

Sheet: Evaluation Warning (3)
A5: Evaluation Only. Created with Aspose.Cells for Java.Copyright 2003 - 2016 Aspose Pty Ltd.